<?xml version="1.0" encoding="UTF-8"?>
<!DOCTYPE sistema_usuarios SYSTEM "modelo.dtd">
<sistema_usuarios empresa="TechCampus Solutions" fecha_generacion="2026-04-17">
  <roles>
    <rol id="r_admin" nombre="Administrador" nivel="alto">
      <descripcion>Rol correcto.</descripcion>
    </rol>
  </roles>
  <usuarios>
    <usuario id="u001" rol="r_inexistente" estado="pendiente">
      <nombre>Carlos</nombre>
      <apellidos>Pérez</apellidos>
      <email>carlos.perez@techcampus.local</email>
      <departamento>Ventas</departamento>
      <permisos>
        <permiso tipo="lectura">Consultar clientes</permiso>
      </permisos>
    </usuario>
  </usuarios>
</sistema_usuarios>
